{
  "facebook": "https://facebook.com/bellavistabern",
  "instagram": "https://instagram.com/bellavista.bern",
  "tripadvisor": "https://tripadvisor.ch/restaurant/bella-vista-bern",
  "googleMaps": "https://google.com/maps/place/bella-vista-restaurant-bern",
  "linkedin": "",
  "twitter": "",
  "youtube": "",
  "tiktok": "",
  "pinterest": ""
}
